{
  "schema_version": 1,
  "product_baseline": "Typora 1.13.8 documented feature compatibility",
  "current_milestone": "M0",
  "current_task": "M0-T05",
  "allowed_statuses": ["blocked", "ready", "in_progress", "awaiting_manual", "passed", "failed"],
  "tasks": [
    {
      "id": "M0-T01",
      "status": "passed",
      "depends_on": [],
      "manual_gate": false,
      "evidence": [
        {
          "kind": "command",
          "summary": "corepack pnpm 11.12.0; frozen install exit 0; final pnpm dev exit 0 after responding Lattice window smoke; two consecutive final pnpm build runs exit 0; strict node and renderer tsc checks exit 0",
          "recorded_at": "2026-07-18T12:48:31.4029836Z"
        },
        {
          "kind": "test",
          "summary": "TC-M0-001 ENV-M0-A passed twice in a Chinese-and-space path with an initially empty project-local pnpm store; only pnpm-lock.yaml exists, pending builds are empty, and required artifacts have stable hashes",
          "path": "docs/evidence/M0-T01-bootstrap-2026-07-18.md",
          "recorded_at": "2026-07-18T12:48:31.4029836Z"
        },
        {
          "kind": "report",
          "summary": "Bootstrap dependency, Electron runtime, build, lockfile, artifact, and diagnostic evidence",
          "path": "docs/evidence/M0-T01-bootstrap-2026-07-18.md",
          "recorded_at": "2026-07-18T12:48:31.4029836Z"
        }
      ]
    },
    {
      "id": "M0-T02",
      "status": "passed",
      "depends_on": ["M0-T01"],
      "manual_gate": false,
      "evidence": [
        {
          "kind": "command",
          "summary": "pnpm 11.12.0; frozen offline install exit 0; two fresh pnpm check runs exit 0; E2E, scoped security, performance-harness, and cold-bootstrap gates exit 0",
          "path": "docs/evidence/M0-T02-quality-toolchain-2026-07-18.md",
          "recorded_at": "2026-07-19T09:36:12.9444607Z"
        },
        {
          "kind": "test",
          "summary": "TC-M0-001 offline bootstrap, TC-M0-002 quality fault matrix, and TC-M0-008 cold bootstrap passed; two production builds have matching required artifact hashes and process/temp cleanup scans are clean",
          "path": "docs/evidence/M0-T02-quality-toolchain-2026-07-18.md",
          "recorded_at": "2026-07-19T09:36:12.9444607Z"
        },
        {
          "kind": "report",
          "summary": "Fresh quality toolchain command, coverage, fault-injection, bootstrap, artifact, process, cleanup, and residual-risk evidence",
          "path": "docs/evidence/M0-T02-quality-toolchain-2026-07-18.md",
          "recorded_at": "2026-07-19T09:36:12.9444607Z"
        }
      ]
    },
    {
      "id": "M0-T03",
      "status": "passed",
      "depends_on": ["M0-T02"],
      "manual_gate": false,
      "evidence": [
        {
          "kind": "command",
          "summary": "pnpm 11.12.0; frozen offline install exit 0; no ignored builds; full pnpm check exit 0 with 105 unit and 18 integration tests plus production build",
          "path": "docs/evidence/M0-T03-secure-electron-shell-2026-07-25.md",
          "recorded_at": "2026-07-26T11:00:28.5004194Z"
        },
        {
          "kind": "test",
          "summary": "TC-M0-003 and TC-M0-004 focused real-Electron gates passed 1/1 each; renderer privileges, hostile payloads, navigation, external links, CSP, permissions, and effective DevTools denial verified without residual Electron processes",
          "path": "docs/evidence/M0-T03-secure-electron-shell-2026-07-25.md",
          "recorded_at": "2026-07-26T11:00:28.5004194Z"
        },
        {
          "kind": "report",
          "summary": "Secure Electron bootstrap, BrowserWindow preferences, session/WebContents policy, external URL matrix, finite cleanup, review, and residual ownership evidence",
          "path": "docs/evidence/M0-T03-secure-electron-shell-2026-07-25.md",
          "recorded_at": "2026-07-26T11:00:28.5004194Z"
        }
      ]
    },
    {
      "id": "M0-T04",
      "status": "passed",
      "depends_on": ["M0-T03"],
      "manual_gate": false,
      "evidence": [
        {
          "kind": "command",
          "summary": "pnpm 11.12.0; frozen offline install exit 0; full pnpm check exit 0 with 259 unit and 18 integration tests plus production build; focused real-Electron security and E2E gates exit 0 with 2/2 tests each",
          "path": "docs/evidence/M0-T04-shared-contracts-2026-07-26.md",
          "recorded_at": "2026-07-31T14:15:26.1169046Z"
        },
        {
          "kind": "test",
          "summary": "TC-M0-005 passed strict shared schemas, stable errors, sender/window ownership, bounded JSON-like serialization, redacted logging, frozen preload API, and request-response correlation proofs",
          "path": "docs/evidence/M0-T04-shared-contracts-2026-07-26.md",
          "recorded_at": "2026-07-31T14:15:26.1169046Z"
        },
        {
          "kind": "report",
          "summary": "Independent reviews accepted the IPC architecture and security boundaries after evidence/state completion and wording correction; M0-T05 owns command consumption and M0-T06 owns dependency, license, SBOM, CI, and packaged-artifact gates",
          "path": "docs/evidence/M0-T04-shared-contracts-2026-07-26.md",
          "recorded_at": "2026-07-31T14:15:26.1169046Z"
        }
      ]
    },
    {
      "id": "M0-T05",
      "status": "in_progress",
      "depends_on": ["M0-T04"],
      "manual_gate": false,
      "evidence": []
    },
    {
      "id": "M0-T06",
      "status": "blocked",
      "depends_on": ["M0-T05"],
      "manual_gate": true,
      "evidence": []
    },

    {
      "id": "M1-T01",
      "status": "blocked",
      "depends_on": ["M0-T06"],
      "manual_gate": false,
      "evidence": []
    },
    {
      "id": "M1-T02",
      "status": "blocked",
      "depends_on": ["M1-T01"],
      "manual_gate": false,
      "evidence": []
    },
    {
      "id": "M1-T03",
      "status": "blocked",
      "depends_on": ["M1-T02"],
      "manual_gate": false,
      "evidence": []
    },
    {
      "id": "M1-T04",
      "status": "blocked",
      "depends_on": ["M1-T03"],
      "manual_gate": false,
      "evidence": []
    },
    {
      "id": "M1-T05",
      "status": "blocked",
      "depends_on": ["M1-T04"],
      "manual_gate": false,
      "evidence": []
    },
    {
      "id": "M1-T06",
      "status": "blocked",
      "depends_on": ["M1-T04"],
      "manual_gate": false,
      "evidence": []
    },
    {
      "id": "M1-T07",
      "status": "blocked",
      "depends_on": ["M1-T05", "M1-T06"],
      "manual_gate": false,
      "evidence": []
    },
    {
      "id": "M1-T08",
      "status": "blocked",
      "depends_on": ["M1-T07"],
      "manual_gate": false,
      "evidence": []
    },
    {
      "id": "M1-T09",
      "status": "blocked",
      "depends_on": ["M1-T06", "M1-T07"],
      "manual_gate": false,
      "evidence": []
    },
    {
      "id": "M1-T10",
      "status": "blocked",
      "depends_on": ["M1-T08", "M1-T09"],
      "manual_gate": true,
      "evidence": []
    },

    {
      "id": "M2-T01",
      "status": "blocked",
      "depends_on": ["M1-T10"],
      "manual_gate": false,
      "evidence": []
    },
    {
      "id": "M2-T02",
      "status": "blocked",
      "depends_on": ["M2-T01"],
      "manual_gate": false,
      "evidence": []
    },
    {
      "id": "M2-T03",
      "status": "blocked",
      "depends_on": ["M2-T02"],
      "manual_gate": false,
      "evidence": []
    },
    {
      "id": "M2-T04",
      "status": "blocked",
      "depends_on": ["M2-T02"],
      "manual_gate": false,
      "evidence": []
    },
    {
      "id": "M2-T05",
      "status": "blocked",
      "depends_on": ["M2-T03"],
      "manual_gate": false,
      "evidence": []
    },
    {
      "id": "M2-T06",
      "status": "blocked",
      "depends_on": ["M2-T02"],
      "manual_gate": false,
      "evidence": []
    },
    {
      "id": "M2-T07",
      "status": "blocked",
      "depends_on": ["M2-T03", "M2-T04", "M2-T06"],
      "manual_gate": false,
      "evidence": []
    },
    {
      "id": "M2-T08",
      "status": "blocked",
      "depends_on": ["M2-T05", "M2-T07"],
      "manual_gate": false,
      "evidence": []
    },
    {
      "id": "M2-T09",
      "status": "blocked",
      "depends_on": ["M2-T08"],
      "manual_gate": false,
      "evidence": []
    },
    {
      "id": "M2-T10",
      "status": "blocked",
      "depends_on": ["M2-T09"],
      "manual_gate": true,
      "evidence": []
    },

    {
      "id": "M3-T01",
      "status": "blocked",
      "depends_on": ["M2-T10"],
      "manual_gate": false,
      "evidence": []
    },
    {
      "id": "M3-T02",
      "status": "blocked",
      "depends_on": ["M3-T01"],
      "manual_gate": false,
      "evidence": []
    },
    {
      "id": "M3-T03",
      "status": "blocked",
      "depends_on": ["M3-T02"],
      "manual_gate": false,
      "evidence": []
    },
    {
      "id": "M3-T04",
      "status": "blocked",
      "depends_on": ["M3-T01"],
      "manual_gate": false,
      "evidence": []
    },
    {
      "id": "M3-T05",
      "status": "blocked",
      "depends_on": ["M3-T02"],
      "manual_gate": false,
      "evidence": []
    },
    {
      "id": "M3-T06",
      "status": "blocked",
      "depends_on": ["M3-T02"],
      "manual_gate": false,
      "evidence": []
    },
    {
      "id": "M3-T07",
      "status": "blocked",
      "depends_on": ["M3-T03", "M3-T04", "M3-T05", "M3-T06"],
      "manual_gate": false,
      "evidence": []
    },
    {
      "id": "M3-T08",
      "status": "blocked",
      "depends_on": ["M3-T07"],
      "manual_gate": true,
      "evidence": []
    },

    {
      "id": "M4-T01",
      "status": "blocked",
      "depends_on": ["M3-T08"],
      "manual_gate": false,
      "evidence": []
    },
    {
      "id": "M4-T02",
      "status": "blocked",
      "depends_on": ["M4-T01"],
      "manual_gate": false,